{
  "category": "GPU",
  "manufacturer": "NVIDIA",
  "family": "GeForce",
  "series": "GeForce RTX",
  "generation": "RTX 40 Series",
  "architecture": "Ada Lovelace",
  "source": {
    "name": "NVIDIA official product specifications",
    "url": "https://www.nvidia.com/en-us/geforce/graphics-cards/40-series/rtx-4070-super/"
  },
  "product": {
    "name": "NVIDIA GeForce RTX 4070 SUPER",
    "slug": "rtx-4070-super",
    "description": "GeForce RTX 40 Series graphics card based on the Ada Lovelace architecture.",
    "release_date": "2024-01-17",
    "status": "active",
    "is_popular": true,
    "architecture": "Ada Lovelace"
  },
  "images": [],
  "specifications": [
    { "group": "General", "key": "Architecture", "value": "Ada Lovelace" },
    { "group": "Compute", "key": "CUDA Cores", "value": "7168" },
    { "group": "Memory", "key": "VRAM", "value": "12", "unit": "GB" },
    { "group": "Power", "key": "TDP", "value": "220", "unit": "W" }
  ],
  "benchmarks": []
}
